sentence,label
I was finally able to solve this.,0
You may want to reconsider your design.,0
Copied from a comment for the question/answer mechanism: What are these devices.,0
Is there any specific difference.,0
I just found out.,0
Adding dist: trusty resolved my issue.,0
-CODE-.and: -CODE-,0
I have found the solution / problem.,0
I resolved it by myself.,0
-CODE-.,0
Thank you.,0
I am not 100% sure but I think it might solve the problem.,0
"As I don't know the state of your session and DB when you get to stale object exception, I cannot be sure.",0
I figured this out.,0
Things are clear now.,0
-CODE-.,0